{
  "contentDigest": "9ae78f43fd6dea6c8106d7792a7dfba46d80190b5db5cc4e0f95783640fbff19",
  "decisionCutoff": "2026-08-12T00:00:00Z",
  "edges": [
    {
      "evidence": {
        "confidence": 0.3,
        "grade": "MODEL_INFERRED",
        "reviewStatus": "not_required",
        "sourceIds": [
          "source:red-sea-rerouting-restress:assumptions"
        ]
      },
      "from": "node:red-sea-rerouting-restress:red-sea",
      "id": "edge:red-sea-rerouting-restress:link-1",
      "observedAt": "2026-08-12T00:00:00Z",
      "properties": {
        "eligibleForPrimaryEstimate": false,
        "factualStatus": "model_assumption"
      },
      "relation": "depends_on",
      "to": "node:red-sea-rerouting-restress:voyage",
      "validFrom": "2026-08-12T00:00:00Z",
      "weight": {
        "lower": 0.54,
        "unit": "share",
        "upper": 0.9,
        "value": 0.74
      }
    },
    {
      "evidence": {
        "confidence": 0.3,
        "grade": "MODEL_INFERRED",
        "reviewStatus": "not_required",
        "sourceIds": [
          "source:red-sea-rerouting-restress:assumptions"
        ]
      },
      "from": "node:red-sea-rerouting-restress:voyage",
      "id": "edge:red-sea-rerouting-restress:link-2",
      "observedAt": "2026-08-12T00:00:00Z",
      "properties": {
        "eligibleForPrimaryEstimate": false,
        "factualStatus": "model_assumption"
      },
      "relation": "depends_on",
      "to": "node:red-sea-rerouting-restress:inputs",
      "validFrom": "2026-08-12T00:00:00Z",
      "weight": {
        "lower": 0.37,
        "unit": "share",
        "upper": 0.73,
        "value": 0.57
      }
    },
    {
      "evidence": {
        "confidence": 0.3,
        "grade": "MODEL_INFERRED",
        "reviewStatus": "not_required",
        "sourceIds": [
          "source:red-sea-rerouting-restress:assumptions"
        ]
      },
      "from": "node:red-sea-rerouting-restress:inputs",
      "id": "edge:red-sea-rerouting-restress:link-3",
      "observedAt": "2026-08-12T00:00:00Z",
      "properties": {
        "eligibleForPrimaryEstimate": false,
        "factualStatus": "model_assumption",
        "temporalPattern": "expires_during_horizon"
      },
      "relation": "depends_on",
      "to": "node:red-sea-rerouting-restress:production",
      "validFrom": "2026-08-12T00:00:00Z",
      "validTo": "2026-09-15T00:00:00Z",
      "weight": {
        "lower": 0.43,
        "unit": "share",
        "upper": 0.79,
        "value": 0.63
      }
    },
    {
      "evidence": {
        "confidence": 0.3,
        "grade": "MODEL_INFERRED",
        "reviewStatus": "not_required",
        "sourceIds": [
          "source:red-sea-rerouting-restress:assumptions"
        ]
      },
      "from": "node:red-sea-rerouting-restress:production",
      "id": "edge:red-sea-rerouting-restress:link-4",
      "observedAt": "2026-08-12T00:00:00Z",
      "properties": {
        "eligibleForPrimaryEstimate": false,
        "factualStatus": "model_assumption"
      },
      "relation": "depends_on",
      "to": "node:red-sea-rerouting-restress:delivery",
      "validFrom": "2026-08-12T00:00:00Z",
      "weight": {
        "lower": 0.31,
        "unit": "share",
        "upper": 0.67,
        "value": 0.51
      }
    }
  ],
  "generatedAt": "2026-08-12T00:00:00Z",
  "nodes": [
    {
      "description": "Illustrative node in an explicitly assumed stress topology.",
      "evidence": {
        "confidence": 0.35,
        "grade": "MODEL_INFERRED",
        "reviewStatus": "not_required",
        "sourceIds": [
          "source:red-sea-rerouting-restress:assumptions"
        ]
      },
      "id": "node:red-sea-rerouting-restress:delivery",
      "kind": "metric",
      "label": "Delivery continuity",
      "observedAt": "2026-08-12T00:00:00Z",
      "properties": {
        "bufferShare": 0,
        "criticality": 1.4,
        "factualStatus": "model_construct"
      },
      "validFrom": "2026-08-12T00:00:00Z"
    },
    {
      "description": "Illustrative node in an explicitly assumed stress topology.",
      "evidence": {
        "confidence": 0.35,
        "grade": "MODEL_INFERRED",
        "reviewStatus": "not_required",
        "sourceIds": [
          "source:red-sea-rerouting-restress:assumptions"
        ]
      },
      "id": "node:red-sea-rerouting-restress:inputs",
      "kind": "product",
      "label": "Imported production inputs",
      "observedAt": "2026-08-12T00:00:00Z",
      "properties": {
        "bufferShare": 0,
        "criticality": 1.3,
        "factualStatus": "model_construct"
      },
      "validFrom": "2026-08-12T00:00:00Z"
    },
    {
      "description": "Illustrative node in an explicitly assumed stress topology.",
      "evidence": {
        "confidence": 0.35,
        "grade": "MODEL_INFERRED",
        "reviewStatus": "not_required",
        "sourceIds": [
          "source:red-sea-rerouting-restress:assumptions"
        ]
      },
      "id": "node:red-sea-rerouting-restress:production",
      "kind": "industry",
      "label": "Downstream production",
      "observedAt": "2026-08-12T00:00:00Z",
      "properties": {
        "bufferShare": 0,
        "criticality": 1.5,
        "factualStatus": "model_construct"
      },
      "validFrom": "2026-08-12T00:00:00Z"
    },
    {
      "description": "Illustrative node in an explicitly assumed stress topology.",
      "evidence": {
        "confidence": 0.35,
        "grade": "MODEL_INFERRED",
        "reviewStatus": "not_required",
        "sourceIds": [
          "source:red-sea-rerouting-restress:assumptions"
        ]
      },
      "id": "node:red-sea-rerouting-restress:red-sea",
      "kind": "route",
      "label": "Red Sea shipping route",
      "observedAt": "2026-08-12T00:00:00Z",
      "properties": {
        "bufferShare": 0,
        "criticality": 1.4,
        "factualStatus": "model_construct"
      },
      "validFrom": "2026-08-12T00:00:00Z"
    },
    {
      "description": "Illustrative node in an explicitly assumed stress topology.",
      "evidence": {
        "confidence": 0.35,
        "grade": "MODEL_INFERRED",
        "reviewStatus": "not_required",
        "sourceIds": [
          "source:red-sea-rerouting-restress:assumptions"
        ]
      },
      "id": "node:red-sea-rerouting-restress:voyage",
      "kind": "industry",
      "label": "Long-haul voyage capacity",
      "observedAt": "2026-08-12T00:00:00Z",
      "properties": {
        "bufferShare": 0,
        "criticality": 1.2,
        "factualStatus": "model_construct"
      },
      "validFrom": "2026-08-12T00:00:00Z"
    }
  ],
  "schemaVersion": "0.1.0",
  "snapshotId": "snapshot:red-sea-rerouting-restress:assumed-topology",
  "sources": [
    {
      "artifactKind": "normalized_snapshot",
      "availableAt": "2026-08-12T00:00:00Z",
      "bytes": 4027,
      "contentType": "application/json",
      "digestScope": "exact_bytes",
      "id": "source:red-sea-rerouting-restress:assumptions",
      "license": {
        "mode": "redistributable",
        "name": "Apache-2.0",
        "notes": "Covers the locally authored assumption register, not the linked context page.",
        "spdx": "Apache-2.0",
        "termsUri": "https://www.apache.org/licenses/LICENSE-2.0"
      },
      "publishedAt": "2026-08-12T00:00:00Z",
      "publisher": "CascadeLens",
      "retrievedAt": "2026-08-12T00:00:00Z",
      "role": "input",
      "sha256": "01d162ffb498fc2c834ad9ffa6a0c0ea7e2defb58d555d5b0adabc9c8a74996e",
      "title": "Red Sea rerouting re-stress local assumption register",
      "uri": "https://github.com/limingrui679-design/CascadeLens/blob/main/content/cases/red-sea-rerouting-restress/assumptions.json"
    },
    {
      "artifactKind": "citation_record",
      "availableAt": "2024-02-22T00:00:00Z",
      "contentType": "application/json",
      "digestScope": "canonical_record",
      "id": "source:red-sea-rerouting-restress:context",
      "license": {
        "mode": "download_on_run",
        "name": "Linked publisher terms apply",
        "notes": "Citation metadata only. The linked page is not redistributed and does not supply model weights.",
        "termsUri": "https://unctad.org/publication/navigating-troubled-waters-impact-global-trade-disruption-shipping-routes-red-sea-black"
      },
      "publishedAt": "2024-02-22T00:00:00Z",
      "publisher": "UN Trade and Development",
      "retrievedAt": "2026-08-12T00:00:00Z",
      "role": "context",
      "sha256": "6b0787b0c566324c9ebefd432dfd390e7756287f85a9ad4915bc406f4de73a9f",
      "title": "Navigating troubled waters: Impact to global trade of disruption of shipping routes",
      "uri": "https://unctad.org/publication/navigating-troubled-waters-impact-global-trade-disruption-shipping-routes-red-sea-black"
    }
  ],
  "title": "Red Sea rerouting re-stress assumed topology"
}
