{
  "contentDigest": "db6bc9e6ad54a2c42e14d431fd31a544633b84fb46a8a45f284d12831dee6814",
  "decisionCutoff": "2026-08-12T00:00:00Z",
  "edges": [
    {
      "evidence": {
        "confidence": 0.3,
        "grade": "MODEL_INFERRED",
        "reviewStatus": "not_required",
        "sourceIds": [
          "source:critical-minerals-export-stress:assumptions"
        ]
      },
      "from": "node:critical-minerals-export-stress:exports",
      "id": "edge:critical-minerals-export-stress:link-1",
      "observedAt": "2026-08-12T00:00:00Z",
      "properties": {
        "eligibleForPrimaryEstimate": false,
        "factualStatus": "model_assumption"
      },
      "relation": "depends_on",
      "to": "node:critical-minerals-export-stress:mineral",
      "validFrom": "2026-08-12T00:00:00Z",
      "weight": {
        "lower": 0.64,
        "unit": "share",
        "upper": 1,
        "value": 0.84
      }
    },
    {
      "evidence": {
        "confidence": 0.3,
        "grade": "MODEL_INFERRED",
        "reviewStatus": "not_required",
        "sourceIds": [
          "source:critical-minerals-export-stress:assumptions"
        ]
      },
      "from": "node:critical-minerals-export-stress:mineral",
      "id": "edge:critical-minerals-export-stress:link-2",
      "observedAt": "2026-08-12T00:00:00Z",
      "properties": {
        "eligibleForPrimaryEstimate": false,
        "factualStatus": "model_assumption"
      },
      "relation": "depends_on",
      "to": "node:critical-minerals-export-stress:component",
      "validFrom": "2026-08-12T00:00:00Z",
      "weight": {
        "lower": 0.5,
        "unit": "share",
        "upper": 0.86,
        "value": 0.7
      }
    },
    {
      "evidence": {
        "confidence": 0.3,
        "grade": "MODEL_INFERRED",
        "reviewStatus": "not_required",
        "sourceIds": [
          "source:critical-minerals-export-stress:assumptions"
        ]
      },
      "from": "node:critical-minerals-export-stress:component",
      "id": "edge:critical-minerals-export-stress:link-3",
      "observedAt": "2026-08-12T00:00:00Z",
      "properties": {
        "eligibleForPrimaryEstimate": false,
        "factualStatus": "model_assumption"
      },
      "relation": "depends_on",
      "to": "node:critical-minerals-export-stress:manufacturing",
      "validFrom": "2026-08-12T00:00:00Z",
      "weight": {
        "lower": 0.44,
        "unit": "share",
        "upper": 0.8,
        "value": 0.64
      }
    },
    {
      "evidence": {
        "confidence": 0.3,
        "grade": "MODEL_INFERRED",
        "reviewStatus": "not_required",
        "sourceIds": [
          "source:critical-minerals-export-stress:assumptions"
        ]
      },
      "from": "node:critical-minerals-export-stress:manufacturing",
      "id": "edge:critical-minerals-export-stress:link-4",
      "observedAt": "2026-08-12T00:00:00Z",
      "properties": {
        "eligibleForPrimaryEstimate": false,
        "factualStatus": "model_assumption"
      },
      "relation": "depends_on",
      "to": "node:critical-minerals-export-stress:infrastructure",
      "validFrom": "2026-08-12T00:00:00Z",
      "weight": {
        "lower": 0.28,
        "unit": "share",
        "upper": 0.64,
        "value": 0.48
      }
    }
  ],
  "generatedAt": "2026-08-12T00:00:00Z",
  "nodes": [
    {
      "description": "Illustrative node in an explicitly assumed stress topology.",
      "evidence": {
        "confidence": 0.35,
        "grade": "MODEL_INFERRED",
        "reviewStatus": "not_required",
        "sourceIds": [
          "source:critical-minerals-export-stress:assumptions"
        ]
      },
      "id": "node:critical-minerals-export-stress:component",
      "kind": "product",
      "label": "Technology components",
      "observedAt": "2026-08-12T00:00:00Z",
      "properties": {
        "bufferShare": 0,
        "criticality": 1.4,
        "factualStatus": "model_construct"
      },
      "validFrom": "2026-08-12T00:00:00Z"
    },
    {
      "description": "Illustrative node in an explicitly assumed stress topology.",
      "evidence": {
        "confidence": 0.35,
        "grade": "MODEL_INFERRED",
        "reviewStatus": "not_required",
        "sourceIds": [
          "source:critical-minerals-export-stress:assumptions"
        ]
      },
      "id": "node:critical-minerals-export-stress:exports",
      "kind": "policy",
      "label": "Critical-mineral exports",
      "observedAt": "2026-08-12T00:00:00Z",
      "properties": {
        "bufferShare": 0,
        "criticality": 1.4,
        "factualStatus": "model_construct"
      },
      "validFrom": "2026-08-12T00:00:00Z"
    },
    {
      "description": "Illustrative node in an explicitly assumed stress topology.",
      "evidence": {
        "confidence": 0.35,
        "grade": "MODEL_INFERRED",
        "reviewStatus": "not_required",
        "sourceIds": [
          "source:critical-minerals-export-stress:assumptions"
        ]
      },
      "id": "node:critical-minerals-export-stress:infrastructure",
      "kind": "metric",
      "label": "Infrastructure delivery",
      "observedAt": "2026-08-12T00:00:00Z",
      "properties": {
        "bufferShare": 0,
        "criticality": 1.3,
        "factualStatus": "model_construct"
      },
      "validFrom": "2026-08-12T00:00:00Z"
    },
    {
      "description": "Illustrative node in an explicitly assumed stress topology.",
      "evidence": {
        "confidence": 0.35,
        "grade": "MODEL_INFERRED",
        "reviewStatus": "not_required",
        "sourceIds": [
          "source:critical-minerals-export-stress:assumptions"
        ]
      },
      "id": "node:critical-minerals-export-stress:manufacturing",
      "kind": "industry",
      "label": "Advanced manufacturing",
      "observedAt": "2026-08-12T00:00:00Z",
      "properties": {
        "bufferShare": 0,
        "criticality": 1.6,
        "factualStatus": "model_construct"
      },
      "validFrom": "2026-08-12T00:00:00Z"
    },
    {
      "description": "Illustrative node in an explicitly assumed stress topology.",
      "evidence": {
        "confidence": 0.35,
        "grade": "MODEL_INFERRED",
        "reviewStatus": "not_required",
        "sourceIds": [
          "source:critical-minerals-export-stress:assumptions"
        ]
      },
      "id": "node:critical-minerals-export-stress:mineral",
      "kind": "product",
      "label": "Processed critical mineral",
      "observedAt": "2026-08-12T00:00:00Z",
      "properties": {
        "bufferShare": 0,
        "criticality": 1.5,
        "factualStatus": "model_construct"
      },
      "validFrom": "2026-08-12T00:00:00Z"
    }
  ],
  "schemaVersion": "0.1.0",
  "snapshotId": "snapshot:critical-minerals-export-stress:assumed-topology",
  "sources": [
    {
      "artifactKind": "normalized_snapshot",
      "availableAt": "2026-08-12T00:00:00Z",
      "bytes": 3245,
      "contentType": "application/json",
      "digestScope": "exact_bytes",
      "id": "source:critical-minerals-export-stress:assumptions",
      "license": {
        "mode": "redistributable",
        "name": "Apache-2.0",
        "notes": "Covers the locally authored assumption register, not the linked context page.",
        "spdx": "Apache-2.0",
        "termsUri": "https://www.apache.org/licenses/LICENSE-2.0"
      },
      "publishedAt": "2026-08-12T00:00:00Z",
      "publisher": "CascadeLens",
      "retrievedAt": "2026-08-12T00:00:00Z",
      "role": "input",
      "sha256": "4c0c45cb4d449732fdf0a0eacd87e9b3233d3f2b8eb2597b33db8b1f38b6b44a",
      "title": "Critical-minerals export-control stress local assumption register",
      "uri": "https://github.com/limingrui2/cascadelens/blob/main/content/cases/critical-minerals-export-stress/assumptions.json"
    },
    {
      "artifactKind": "citation_record",
      "availableAt": "2026-02-19T00:00:00Z",
      "contentType": "application/json",
      "digestScope": "canonical_record",
      "id": "source:critical-minerals-export-stress:context",
      "license": {
        "mode": "download_on_run",
        "name": "Linked publisher terms apply",
        "notes": "Citation metadata only. The linked page is not redistributed and does not supply model weights.",
        "termsUri": "https://www.iea.org/news/2026-iea-ministerial-declaration-supporting-the-iea-s-work-on-critical-minerals-security"
      },
      "publishedAt": "2026-02-19T00:00:00Z",
      "publisher": "International Energy Agency",
      "retrievedAt": "2026-08-12T00:00:00Z",
      "role": "context",
      "sha256": "3b7357d66ba1624237ded90a1396e28531034839f9ed89e31de15a1f906081c9",
      "title": "2026 IEA Ministerial Declaration supporting critical-minerals security",
      "uri": "https://www.iea.org/news/2026-iea-ministerial-declaration-supporting-the-iea-s-work-on-critical-minerals-security"
    }
  ],
  "title": "Critical-minerals export-control stress assumed topology"
}
